{"bindings":{"analysis_schema_sha256":"17c842e70f8ebe8b308115562f94e2ee64b0e86caf4a83236d1262e32509c3f9","artifact_sha256":"0f87af4dfd851c268891c96237accf20b5089b0e0b95e10ac1417efebcca83a9","attempt_binding_sha256":"0d92c7bdecff05976c929516664fb840066e265cf2b51e373065357bcadb8b46","cache_identity_sha256":"64f0e5ccf1e243445c09f663f4c0e495530e4ae7b0901b2b2853346ea1a19cee","conformance_report_sha256":"443ba196d1365005044b11e563b36a3d3bba2ce80bdda67834f0d1471ed8bc56","corpus_sha256":"4f768f151885d26de48fe0744cafc2402a27aca61f7f049aac166309891e0c92","d2a_report_sha256":"747b4f1590eda9787c87aae2e25853b8e1e8fa04893e2359eedf7a6050b7acb3","equivalence_sha256":"681adc6b0622a032ff2599024c9c53f6268476b53c9a07f79c590b92831e9689","mechanism_analysis_sha256":"0e45bd4dd56cb0c437cfd3ecc8f79d034339f285609da5287678991ee4498bf2","protocol_sha256":"d412ba3a4311640234b9291ac458da321a77db9da0df310cfd3186a56cad3f41","raw_report_sha256":"e0a3a2243824ca5b648f0e705f1209a4ea006beb2ea1ed0d1a2649910da0c18f","source_commit":"5ce9799f6396520a7bb03d414bf0e81ff13a6700","trace_schema_sha256":"5a938a24c774cbf9deef7c764184270ae1925a8edbfeecf321c9d2b4844d8c72","trace_set_sha256":"91bfa76f1914c0404b1c69d95ff9672ce7b3b1ab141ea4e9b2032098f991ec8b"},"controls":[{"candidate_id":"candidate-b697b0b731b02e50211021bd2d2e842d520215cee258d1124709fe2b9d421488","case_id":"changesets/changesets","category":"monorepo","comparative_status":"selected","path":"packages/cli/bin.js","scan_complete":false,"status":"selected-true-positive"},{"candidate_id":"candidate-014007729ee0a0802272c6de829e3775cce7f4f9d19054a1769c53eee1a0462e","case_id":"vercel/turborepo","category":"monorepo","comparative_status":"selected","path":"crates/turborepo/src/main.rs","scan_complete":false,"status":"selected-true-positive"},{"candidate_id":"candidate-5c1b865c2f0171549e97f5616a020b561b77087e54a6b3f98c0f0e8dd3a6c137","case_id":"burntsushi/ripgrep","category":"rust-cli","comparative_status":"selected","path":"crates/core/main.rs","scan_complete":false,"status":"selected-true-positive"},{"candidate_id":"candidate-f40d4a0647d98b9f55c02663b79ec3dcf421b8ecfd7148d3bf1494c94c7d83e8","case_id":"sharkdp/fd","category":"rust-cli","comparative_status":"selected","path":"src/main.rs","scan_complete":true,"status":"selected-true-positive"},{"candidate_id":"candidate-70b529f147e80b778f5259b80e8966bee47f0a45e60686b7c44d1e04de011710","case_id":"sharkdp/bat","category":"rust-cli","comparative_status":"selected","path":"src/bin/bat/main.rs","scan_complete":true,"status":"selected-true-positive"},{"candidate_id":"candidate-55e8aab96471a6fba195c00f1aecdcd3c00b11a20c5fe81c04430ef70381bbff","case_id":"casey/just","category":"rust-cli","comparative_status":"selected","path":"src/main.rs","scan_complete":false,"status":"selected-true-positive"},{"candidate_id":"candidate-db70102d1595c02da0912e6390328196a2ec01c7359c9d1d28fae1de03e025b1","case_id":"eza-community/eza","category":"rust-cli","comparative_status":"not-reviewed","path":"src/main.rs","scan_complete":false,"status":"selected-true-positive"},{"candidate_id":"candidate-69f9261a1c7acca579aa60905c3517950537d3c13128c7d90e1a0e5ed5ef43fa","case_id":"ajeetdsouza/zoxide","category":"rust-cli","comparative_status":"selected","path":"src/main.rs","scan_complete":true,"status":"selected-true-positive"}],"correction_implemented":false,"counterexamples":[{"candidate_id":"candidate-6865202bfb0a2d06d25c05fcb05c2d4d48b7c72338a9c11d3fd106c0a8872dea","case_id":"burntsushi/ripgrep","category":"rust-cli","comparative_status":"selected","path":"crates/matcher/src/lib.rs","scan_complete":false,"status":"selected-false-positive"},{"candidate_id":"candidate-de88f27b0a197596de02bb9d4731bb19c043c0df42b0ba1a74bbfd7f17df2d71","case_id":"sharkdp/bat","category":"rust-cli","comparative_status":"selected","path":"src/lib.rs","scan_complete":true,"status":"selected-false-positive"}],"counts":{"candidates":33484,"cases":30,"control_candidates":8,"control_cases":8,"control_categories":2,"counterexamples":2,"eligible_candidates":28749,"incomplete_scans":9,"support_candidates":15,"support_cases":8,"support_categories":2},"disposition":"supported-generic-hypothesis","effects":{"added_false_negative_range":[0,8],"displacement_risk":"observed","false_positive_range":[0,15],"precision_direction":"Predicted non-decreasing only if focused tests discriminate package-declarations from executable controls; otherwise Unknown.","recall_direction":"non-increasing-under-blanket-suppression","true_positive_displacement_range":[0,8]},"governance":{"human_label_governance":"separate-and-blocked","independent_evidence":false,"next_action":"one-bounded-correction-cycle","outcome_aware":true},"limitations":["Strict equivalence remains failed-required-comparison-unavailable; candidate-membership and scan-diagnostic equivalence are Unknown.","This outcome-aware development analysis is correlated, unblinded, and not independent release evidence.","Frozen labels may be wrong and comparative-review status is a correlated control, not ground truth.","Nine historical scans are incomplete; missing evidence remains Unknown.","Counts are associations, not proof of causal non-interference or counterfactual score effect.","The 0-15 false-positive and 0-8 displacement bounds cover the shared final mechanism; the observed package-declarations substage split is 12 false positives and 0 true positives, but no counterfactual was executed.","No official score was recalculated and no behavior, artifact, public capability, label, threshold, policy, corpus, or configuration changed."],"next_correction_boundary":"One separately authorized, test-first change limited to the package-declarations admission branch in src/code-intel/curate.js; no implementation or corpus run is authorized by this analysis.","preferred_hypothesis":{"claim":"The shared final mechanism conflates executable entrypoints with manifest-declared package targets. All 12 selections made by package-declarations are frozen false positives, while manifest-entrypoints supplies 8 true-positive controls and 3 false positives. This supports separating admission boundaries, not blanket suppression.","falsification":"Before any corpus run, focused fixtures must show declaration-only package targets rejected, independently salient package targets retained, executable controls unchanged, deterministic cap ordering, and no synthetic trace-on/off difference. Any lost executable control, unexplained displacement, or need for a path, label, category, or repository special case falsifies the boundary.","id":"manifest-entrypoint-stage-conflation","production_mechanism":"src/code-intel/curate.js: the quota-bound manifest-entrypoints executable stage and the later package-declarations stage both emit final selection_heuristic manifest-entrypoint.","small_correction":"In one separately authorized cycle, change only package-declarations admission so a package target cannot enter solely from its declaration and must satisfy an existing independent generic salience mechanism; leave executable entrypoints, ranking, scanning, policy, thresholds, labels, corpus, and configuration unchanged."},"schema_version":"kanon-d2e-analysis-v1","support":[{"candidate_id":"candidate-17b6d12d5e946f062f7866cafff41110cf3aa7d3ff6eb1d8affb41117d932975","case_id":"changesets/changesets","category":"monorepo","comparative_status":"unselected","path":"packages/color/src/index.ts","scan_complete":false,"status":"selected-false-positive"},{"candidate_id":"candidate-e34440a75fcf2f149ced6b7d9e0dd0300c8c970a7ae7158e7c0e37585e31b179","case_id":"changesets/changesets","category":"monorepo","comparative_status":"unselected","path":"scripts/test-utils/src/index.ts","scan_complete":false,"status":"selected-false-positive"},{"candidate_id":"candidate-fc06bb16166e2cc075f6c1665c0baf52a7e55e3442ba39b7d71ac1053e8c91f9","case_id":"vercel/turborepo","category":"monorepo","comparative_status":"unselected","path":"crates/turbo-trace/src/main.rs","scan_complete":false,"status":"selected-false-positive"},{"candidate_id":"candidate-f5b6c4902d830eee30f88c27ce0e14f06ca2e419813411eb91db000b6f0a5b91","case_id":"sveltejs/kit","category":"monorepo","comparative_status":"unselected","path":"packages/adapter-static/index.js","scan_complete":false,"status":"selected-false-positive"},{"candidate_id":"candidate-8ad5411e288adcc7cda90b5938321b274dd0e95abc0f0f7061c211163fe2bd6c","case_id":"sveltejs/kit","category":"monorepo","comparative_status":"unselected","path":"packages/kit/svelte-kit.js","scan_complete":false,"status":"selected-false-positive"},{"candidate_id":"candidate-03ce8301e7ede68f44eb11bab94a6e746c85af310675c5ef5b952947dd85a6f4","case_id":"sveltejs/kit","category":"monorepo","comparative_status":"unselected","path":"packages/package/svelte-package.js","scan_complete":false,"status":"selected-false-positive"},{"candidate_id":"candidate-d87d2c045a3cd4bc541108c18b4497e98b97d8ffc16164e7e2288e02c23c2221","case_id":"vuejs/core","category":"monorepo","comparative_status":"unselected","path":"packages/vue/index.js","scan_complete":true,"status":"selected-false-positive"},{"candidate_id":"candidate-a462a80f66062d5c18d37c416b6bb287c846de25a043a2780ad597bb5d37b3c3","case_id":"vuejs/core","category":"monorepo","comparative_status":"unselected","path":"packages/vue/index.mjs","scan_complete":true,"status":"selected-false-positive"},{"candidate_id":"candidate-d231c7e14f2d0612b6b38d2d6f2db9effcd2c6295ab2ff286db836412989e3b0","case_id":"vuejs/core","category":"monorepo","comparative_status":"unselected","path":"packages/vue/jsx.d.ts","scan_complete":true,"status":"selected-false-positive"},{"candidate_id":"candidate-5ed9c9a0a168d624f5fa71ca1e951bd0abf7e5861c079a825609e24fe730c405","case_id":"tanstack/query","category":"monorepo","comparative_status":"unselected","path":"packages/angular-query-experimental/src/index.ts","scan_complete":false,"status":"selected-false-positive"},{"candidate_id":"candidate-d0ba5dbd66e4072e1b019f4455908a89d1515b7eb044